{"contract_type":"policy_transition_record","contract_version":"1.0","activation_state":"inactive","schema_version":"1.0","transition_id":"transition-001","repository_identity":{"repository_full_name":"rezahh107/example","repository_id":42},"current_policy_identity":"sha256:aaaaaaaaaaaaaaaaaaaaaaaaaaaaaaaaaaaaaaaaaaaaaaaaaaaaaaaaaaaaaaaa","target_policy_identity":"sha256:bbbbbbbbbbbbbbbbbbbbbbbbbbbbbbbbbbbbbbbbbbbbbbbbbbbbbbbbbbbbbbbb","evaluation_policy_identity":"sha256:aaaaaaaaaaaaaaaaaaaaaaaaaaaaaaaaaaaaaaaaaaaaaaaaaaaaaaaaaaaaaaaa","evaluation_policy_role":"current_policy","transition_pr_number":7,"exact_head_sha":"1111111111111111111111111111111111111111","transition_scope_digest":"sha256:cccccccccccccccccccccccccccccccccccccccccccccccccccccccccccccccc","owner_authority_verified":false,"exact_head_ci":"NOT_RUN","scope_validation":"NOT_RUN","secret_or_credential_change":false,"unauthorized_permission_escalation":false,"ruleset_or_branch_protection_mutation":false,"external_repository_write":false,"destructive_or_irreversible_action":false,"unrelated_implementation_bundled":false,"activation_condition_record_refs":[],"owner_merge_required":true,"owner_merge_evidence_ref":null,"merge_method":"merge_commit","merge_result_proof_ref":null,"current_main_validation":"NOT_RUN","post_merge_closure_status":"not_started","status_reconciliation_ref":null,"transition_receipt_ref":null,"missing_historical_evidence_disclosures":[]}
